{"entries":[],"metrics":{"complete_call_ns":["682430","699940","699073","709096","747799","700776","670068","709221","717784"],"peak_bytes":0},"plan":"db545a7f415ff28c2d492c5def2e53b5f8102cc0bae8db2560199623123a30c4","program":"0bfdd6d8f4ac77ef240c7ec17dc331608b95834b9d6220ae0548513fba5b6a2b","schema":1,"target":{"backend":"literal_wasm_full","bridge":"node/captured-wasm-owned; raw f101a85c2d7c9a629b1bf82743a73c41699a4a42b62219b557f9d2cc0291fef2","driver":"v26.1.0","hardware":"macOS-26.5.2-arm64-arm-64bit arm64","toolchain":"frozen engine28 c0f3651f11c04b2a4f30740a1239f3192af52c3cdff4523076456624cc557bbc"},"workload":{"concurrency":1,"distribution":{"scope":"fixed cheap/heavy callbacks and low/high acceptance recipes; no changing-load claim","statistic":"nine positive per-call samples, rounded to integer nanoseconds"},"residency":"captured-wasm-owned","shape":{"frame":"pipeline30_calibrated_selection_heldout_u32-low-65536","input_elements":65536,"memory_metric":"not measured; peak_bytes=0 is an explicit unknown sentinel","task":"pipeline30_calibrated_selection_heldout_u32"}}}
