{"entries":["cec38db06c0cdab5f0feab7e022e89feaec7637d47fe0194cce988240f9deb1a"],"metrics":{"complete_call_ns":["3285","3266","3273","3283","3380","3213","3259"],"peak_bytes":1638400},"plan":"e26668b720bf61425beec7fe75f9389fa47f5958dec0b7e473f736215d780fad","program":"9d114d25ba3efceb94c26c8b1fa7a51c9379f1daa6171854f35e11f8e220d06c","schema":1,"target":{"backend":"ink_checked_wasm","bridge":"U32 snapshot/input copy/result return; runner 5fd2359bd3016ff4f1991955d94e3d79375cb32c8074a040fe912c831e8d2836","driver":"node: v26.1.0; peak_bytes=exported Wasm linear-memory highwater only; host/GPU excluded","hardware":"Apple M2","toolchain":"{\"ink\": \"45670dbced0999e945278d7de7ed495cad9b43b1ab9d24c27182c9f9a5683e08\", \"rustc\": \"rustc 1.96.0 (ac68faa20 2026-05-25)\\nbinary: rustc\\ncommit-hash: ac68faa20c58cbccd01ee7208bf3b6e93a7d7f96\\ncommit-date: 2026-05-25\\nhost: aarch64-apple-darwin\\nrelease: 1.96.0\\nLLVM version: 22.1.2\", \"zig\": \"0.15.2\"}"},"workload":{"concurrency":1,"distribution":"full-32","residency":"host-resident typed U32 input; warm modules","shape":{"case":"generic_self_zip","factor":4294967293,"length":32,"seed":2147483648}}}
