{"entries":["15604a90b834fb985fcc26b1fb5dc33cd6c70cb1caaf8de064cf0860215927e0","33af42337320043efcf6dd828fc0ad00fe83321ce281670a1b6a2497f515b08c","5f7cb5eb6f258aab9a795ae762694f7349d5d7eb815067b608dfa9b4e2995fea","61c8f5a90ba403ee1cf5c4684969b2de05fb968afd5d9f880fa3767df01f23a9","7cd8700326f91c2415dec52cd12ee7c8f9c348de227c7c7eba99c4d1927c6a37","7dfca53336f5698649375d4945bfc2e2c345e3254ba7f627e986fafcfca7757e","917af83245260c07fff0e281e84c43cc6ea24eec0dad8743c75a2d14a3393827","c263adb0be6b2760f51c63029104184fd0ebfb4246a8c70230897beab243550b"],"metrics":{"complete_call_ns":["4138","3658","3464","3485","3329","3731","3335"],"peak_bytes":1638400},"plan":"48e4dea0295925401ec7c68bc5c902b897ea9fc2f1690ca11d1c2498ee66aa99","program":"9f04792e543711b071e2c38634a36becb2ed76fe93f4c9fbaf404450f8e4bae8","schema":1,"target":{"backend":"ink_checked_wasm","bridge":"typed U32 host capture + input copy + result return; common runner.mjs 50ee3ddfb09f9c6b8f9a3c4c8da1f01174386dd16aee155ec7051948b2827c56","driver":"node: v26.1.0; peak_bytes=maximum exported Wasm linear memory only; JS host/GPU excluded","hardware":"Apple M2","toolchain":"{\"ink_compiler\": \"1038e4518a7f24b8113f916ba12f9b48440228f107118076465b4194cfca033e\", \"rustc\": \"rustc 1.96.0 (ac68faa20 2026-05-25)\\nbinary: rustc\\ncommit-hash: ac68faa20c58cbccd01ee7208bf3b6e93a7d7f96\\ncommit-date: 2026-05-25\\nhost: aarch64-apple-darwin\\nrelease: 1.96.0\\nLLVM version: 22.1.2\", \"zig\": \"0.15.2\"}"},"workload":{"concurrency":1,"distribution":"full-4096","residency":"host-resident typed input; warm Wasm modules","shape":{"case":"mapped_count","factor":4294967292,"length":4096,"seed":2147483648}}}
