{"entries":[],"metrics":{"complete_call_ns":["10458","11005","9979","11210","10048","10526","10390","11073","10458"],"peak_bytes":1769472},"plan":"ce4eac1391107f50274d7e2ad22c479a96c867206015118fa7d5d6ccf23e0133","program":"6e8e79c8251232410c4ad8f9d59b9e0f13506e2790b92a7b32b81d08ecf49215","schema":1,"target":{"backend":"ink_baseline_wasm","bridge":"Per-task U32 snapshots/typed capture, independent lists; runner b67309dc63e0d9fe94300050790568ae23e4a6955386ceb99eb48250f0793440","driver":"browser:Mozilla/5.0 (Macintosh; Intel Mac OS X 10_15_7) AppleWebKit/537.36 (KHTML, like Gecko) Chrome/154.0.0.0 Safari/537.36; exported Wasm memory only","hardware":"Apple M2","toolchain":"{\"ink\": \"45670dbced0999e945278d7de7ed495cad9b43b1ab9d24c27182c9f9a5683e08\", \"rustc\": \"rustc 1.96.0 (ac68faa20 2026-05-25)\\nbinary: rustc\\ncommit-hash: ac68faa20c58cbccd01ee7208bf3b6e93a7d7f96\\ncommit-date: 2026-05-25\\nhost: aarch64-apple-darwin\\nrelease: 1.96.0\\nLLVM version: 22.1.2\", \"zig\": \"0.15.2\"}"},"workload":{"concurrency":1,"distribution":"filtered_mapped_arbitrary_fold_u32/full-4096","residency":"resident host input; warm modules; captured calls","shape":{"case":"filtered_mapped_arbitrary_fold_u32","factor":4294967293,"length":4096,"second_length":0,"seed":2654435769}}}
