{"entries":[],"metrics":{"complete_call_ns":["237313","247761","247761","223881","237313","240299","217910","240299","246269"],"peak_bytes":1638400},"plan":"c49687ab03e42df74748a105fd9890061459315cc9977a232b5abbe9e46ca0b4","program":"0e5afc76e28270562cef1f39a9b251d2a0b0642fe997dfda323ad96051a729ea","schema":1,"target":{"backend":"ink_baseline_wasm","bridge":"Per-task U32 single-list snapshots/typed capture; runner b35e9c348e9ea434e091a1aaa8331a08a2e6fe15df8690cec7e1a490306a61e5","driver":"browser:Mozilla/5.0 (Macintosh; Intel Mac OS X 10_15_7) AppleWebKit/537.36 (KHTML, like Gecko) Chrome/154.0.0.0 Safari/537.36; exported Wasm memory only","hardware":"Apple M2","toolchain":"{\"ink\": \"45670dbced0999e945278d7de7ed495cad9b43b1ab9d24c27182c9f9a5683e08\", \"rustc\": \"rustc 1.96.0 (ac68faa20 2026-05-25)\\nbinary: rustc\\ncommit-hash: ac68faa20c58cbccd01ee7208bf3b6e93a7d7f96\\ncommit-date: 2026-05-25\\nhost: aarch64-apple-darwin\\nrelease: 1.96.0\\nLLVM version: 22.1.2\", \"zig\": \"0.15.2\"}"},"workload":{"concurrency":1,"distribution":"skip_partition_count_u32_heldout/small-65536","residency":"resident host input; warm modules; captured calls","shape":{"case":"skip_partition_count_u32_heldout","factor":768,"length":65536,"second_length":0,"seed":512}}}
