{"entries":["6e00f44984a4095c6a7d731777308b7d775726fd91bbe425b12e99c6b26a8144"],"metrics":{"complete_call_ns":["3686","3722","3684","3692","3771","3684","3669","3681","3651"],"peak_bytes":1900544},"plan":"974051b6d75e0309e9abd457a265d3b637d2aac1260a06137b22d1b5cbdf99f6","program":"e7b250d880c2ec6d23d429f551cb3ec5b582a269ee4c4a020fb0ebcb1886e584","schema":1,"target":{"backend":"ink_checked_wasm","bridge":"Per-task U32 snapshots/typed capture, independent lists; runner a07c521e1f5e418dd1c17f9a28687bc90030ffd8e847ebf66cbbfbfa0830a5f1","driver":"node:v26.1.0; exported Wasm memory only","hardware":"Apple M2","toolchain":"{\"ink\": \"45670dbced0999e945278d7de7ed495cad9b43b1ab9d24c27182c9f9a5683e08\", \"rustc\": \"rustc 1.96.0 (ac68faa20 2026-05-25)\\nbinary: rustc\\ncommit-hash: ac68faa20c58cbccd01ee7208bf3b6e93a7d7f96\\ncommit-date: 2026-05-25\\nhost: aarch64-apple-darwin\\nrelease: 1.96.0\\nLLVM version: 22.1.2\", \"zig\": \"0.15.2\"}"},"workload":{"concurrency":1,"distribution":"keyed_projection_repeat_u32/full-32","residency":"resident host input; warm modules; captured calls","shape":{"case":"keyed_projection_repeat_u32","factor":4294967293,"length":32,"second_length":32,"seed":2654435769}}}
