{"entries":[],"metrics":{"complete_call_ns":["493750","487500","481250","462500","537500","481250","481250","475000","475000"],"peak_bytes":536},"plan":"60cedeaa5fcd6bb217ab2982d19310c935e33d9bf81d5787ad254f7543e0fa70","program":"431e61c692b4960fde72371fa936fc99577b846241dfd7266821702add15cea7","schema":1,"target":{"backend":"current_gpu_requested","bridge":"gpu/full; raw 659248674cbe7b1b3c0978c468faea8abb0ae9b81c1f2b203fe584d0567cbae4","driver":"Mozilla/5.0 (Macintosh; Intel Mac OS X 10_15_7) AppleWebKit/537.36 (KHTML, like Gecko) Chrome/154.0.0.0 Safari/537.36","hardware":"macOS-26.5.2-arm64-arm-64bit arm64","toolchain":"frozen28 compiler c0f3651f11c04b2a4f30740a1239f3192af52c3cdff4523076456624cc557bbc; matched controls bound in measurement plan"},"workload":{"concurrency":1,"distribution":{"controls":"frozen fixtures and complete goldens","scope":"exact fixed batch27 checked core; no reselection","statistic":"nine raw per-call timings, rounded to integer nanoseconds; preparation/capture boundary explicit"},"residency":"full","shape":{"frame":"reference_modular_mix_u32/small-32","input_elements":32,"memory_metric":"reported WebGPU live buffer peak, excludes host heap","task":"reference_modular_mix_u32"}}}
