{"entries":[],"metrics":{"complete_call_ns":["474","439","399","468","399","428","442","471","422"],"peak_bytes":2555904},"plan":"03518b21a7df28a826e6851f4a90fe05abc9f6e4620c5a3dadeb8a703c625749","program":"5e91085280666597e3e830fc46113b00a8d60dde6a055b0cd4dc4735727214f5","schema":1,"target":{"backend":"rust_literal_wasm","bridge":"Per-task U32 single-list snapshots/typed capture; runner b35e9c348e9ea434e091a1aaa8331a08a2e6fe15df8690cec7e1a490306a61e5","driver":"browser:Mozilla/5.0 (Macintosh; Intel Mac OS X 10_15_7) AppleWebKit/537.36 (KHTML, like Gecko) Chrome/154.0.0.0 Safari/537.36; exported Wasm memory only","hardware":"Apple M2","toolchain":"{\"ink\": \"45670dbced0999e945278d7de7ed495cad9b43b1ab9d24c27182c9f9a5683e08\", \"rustc\": \"rustc 1.96.0 (ac68faa20 2026-05-25)\\nbinary: rustc\\ncommit-hash: ac68faa20c58cbccd01ee7208bf3b6e93a7d7f96\\ncommit-date: 2026-05-25\\nhost: aarch64-apple-darwin\\nrelease: 1.96.0\\nLLVM version: 22.1.2\", \"zig\": \"0.15.2\"}"},"workload":{"concurrency":1,"distribution":"skip_first_accepted_u32/full-32/interior","residency":"resident host input; warm modules; captured calls","shape":{"case":"skip_first_accepted_u32","factor":3221225473,"length":32,"second_length":0,"seed":2654435769}}}
