{"entries":[],"metrics":{"complete_call_ns":["76","81","75","76","79","79","78","78","79"],"peak_bytes":0},"plan":"98c14afe19d217e2e665affde80ca0720612293d223b9b0cbf605b306915239a","program":"2015e217473894d04d4ba9a735f083e89dbc045621739592ee156cfeef34e975","schema":1,"target":{"backend":"baseline_js_owned","bridge":"browser/borrowed-js-owned; raw 159cb62c6b21274ed799a6e9ca7f71c40dec1193ccb6452ce2c41324f4af135a","driver":"Mozilla/5.0 (Macintosh; Intel Mac OS X 10_15_7) AppleWebKit/537.36 (KHTML, like Gecko) Chrome/154.0.0.0 Safari/537.36","hardware":"macOS-26.5.2-arm64-arm-64bit arm64","toolchain":"frozen28 compiler c0f3651f11c04b2a4f30740a1239f3192af52c3cdff4523076456624cc557bbc; matched controls bound in measurement plan"},"workload":{"concurrency":1,"distribution":{"controls":"frozen fixtures and complete goldens","scope":"exact fixed batch27 checked core; no reselection","statistic":"nine raw per-call timings, rounded to integer nanoseconds; preparation/capture boundary explicit"},"residency":"borrowed-js-owned","shape":{"frame":"helper_indexed_calibration_u32/small-32","input_elements":32,"memory_metric":"not measured; peak_bytes=0 is an explicit unknown sentinel, not a zero-allocation claim","task":"helper_indexed_calibration_u32"}}}
