{"entries":[],"metrics":{"complete_call_ns":["340","345","345","354","340","345","364","349","348"],"peak_bytes":2097152},"plan":"3fd03afa8325b78c2f4cb198c947c3e3b7b4fb0036971be371340032c6dc2cf0","program":"0b47bc73e4b83836341b3c89a4bcf4e508e09465cd5d374f531645d9a1739c0b","schema":1,"target":{"backend":"rust_expert_wasm","bridge":"Per-task U32 snapshots/typed capture, independent lists; runner b67309dc63e0d9fe94300050790568ae23e4a6955386ceb99eb48250f0793440","driver":"node:v26.1.0; exported Wasm memory only","hardware":"Apple M2","toolchain":"{\"ink\": \"45670dbced0999e945278d7de7ed495cad9b43b1ab9d24c27182c9f9a5683e08\", \"rustc\": \"rustc 1.96.0 (ac68faa20 2026-05-25)\\nbinary: rustc\\ncommit-hash: ac68faa20c58cbccd01ee7208bf3b6e93a7d7f96\\ncommit-date: 2026-05-25\\nhost: aarch64-apple-darwin\\nrelease: 1.96.0\\nLLVM version: 22.1.2\", \"zig\": \"0.15.2\"}"},"workload":{"concurrency":1,"distribution":"accepted_calibrated_total/small-32","residency":"resident host input; warm modules; captured calls","shape":{"case":"accepted_calibrated_total","factor":7,"length":32,"second_length":0,"seed":512}}}
