{"entries":[],"metrics":{"complete_call_ns":["3388","3401","3407","3394","3399","3374","3393","3391","3418"],"peak_bytes":1900544},"plan":"3104f68cc509d1da680f2317569224f7bcb4cc908c730e9f75edf1d3d60179a4","program":"8fec6780fdf54f3b784577c41a3d527a738bfe6272cf374c3e1b7dd7061382d4","schema":1,"target":{"backend":"ink_baseline_wasm","bridge":"Per-task U32 single-list snapshots/typed capture; runner b35e9c348e9ea434e091a1aaa8331a08a2e6fe15df8690cec7e1a490306a61e5","driver":"node:v26.1.0; exported Wasm memory only","hardware":"Apple M2","toolchain":"{\"ink\": \"45670dbced0999e945278d7de7ed495cad9b43b1ab9d24c27182c9f9a5683e08\", \"rustc\": \"rustc 1.96.0 (ac68faa20 2026-05-25)\\nbinary: rustc\\ncommit-hash: ac68faa20c58cbccd01ee7208bf3b6e93a7d7f96\\ncommit-date: 2026-05-25\\nhost: aarch64-apple-darwin\\nrelease: 1.96.0\\nLLVM version: 22.1.2\", \"zig\": \"0.15.2\"}"},"workload":{"concurrency":1,"distribution":"pipeline_scan_left_project_u32/full-32","residency":"resident host input; warm modules; captured calls","shape":{"case":"pipeline_scan_left_project_u32","factor":3221225473,"length":32,"second_length":0,"seed":2654435769}}}
