{"entries":[],"metrics":{"complete_call_ns":["2540","2605","2609","2690","2824","2624","2646","2604","2632"],"peak_bytes":2752512},"plan":"e3cd08898958ab1ca6ae34e171d9e5d0065a5d43c7e298162bf62ec38e04031f","program":"e6682a4ff845f5a8817a48d897fa3d62e3d4f551d07b4146c0257b8756f2b504","schema":1,"target":{"backend":"rust_literal_wasm","bridge":"Per-task U32 snapshots/typed capture, independent lists; runner 6702d75d37b39ab1a8a7c398a43a73c7b741c8600c43ef72758327c7ea6bbf43","driver":"node:v26.1.0; exported Wasm memory only","hardware":"Apple M2","toolchain":"{\"ink\": \"45670dbced0999e945278d7de7ed495cad9b43b1ab9d24c27182c9f9a5683e08\", \"rustc\": \"rustc 1.96.0 (ac68faa20 2026-05-25)\\nbinary: rustc\\ncommit-hash: ac68faa20c58cbccd01ee7208bf3b6e93a7d7f96\\ncommit-date: 2026-05-25\\nhost: aarch64-apple-darwin\\nrelease: 1.96.0\\nLLVM version: 22.1.2\", \"zig\": \"0.15.2\"}"},"workload":{"concurrency":1,"distribution":"abi_distance_total/small-4096","residency":"resident host input; warm modules; captured calls","shape":{"case":"abi_distance_total","factor":7,"length":4096,"second_length":0,"seed":512}}}
