{"entries":[],"metrics":{"complete_call_ns":["10753","10578","13389","13540","13854","13330","10833","10524","13616"],"peak_bytes":1900544},"plan":"48519ecd2d01569c131af657b4a8c38aa3ba4f169dc7178973d2e9efe6d68d6c","program":"cdefc3c92a22d8c5d5255fe587f32b89c60f9da4b892d5a141440e7916d6db18","schema":1,"target":{"backend":"ink_prior_wasm","bridge":"Per-task U32 snapshots/typed capture, independent lists; runner 89741e0eb52807251994892f8555ffa94ae1b921eab34cbb8681bd35b81e9627","driver":"node:v26.1.0; exported Wasm memory only","hardware":"Apple M2","toolchain":"{\"ink\": \"45670dbced0999e945278d7de7ed495cad9b43b1ab9d24c27182c9f9a5683e08\", \"rustc\": \"rustc 1.96.0 (ac68faa20 2026-05-25)\\nbinary: rustc\\ncommit-hash: ac68faa20c58cbccd01ee7208bf3b6e93a7d7f96\\ncommit-date: 2026-05-25\\nhost: aarch64-apple-darwin\\nrelease: 1.96.0\\nLLVM version: 22.1.2\", \"zig\": \"0.15.2\"}"},"workload":{"concurrency":1,"distribution":"mapped_arbitrary_fold_u32/small-4096","residency":"resident host input; warm modules; captured calls","shape":{"case":"mapped_arbitrary_fold_u32","factor":7,"length":4096,"second_length":4096,"seed":512}}}
