{"entries":[],"metrics":{"complete_call_ns":["3425","3385","3512","3426","3360","3298","3299"],"peak_bytes":1900544},"plan":"46cc79e44b4280bdffc3471f1d06d078ce9e7ffa9138aa52a0909885701f245f","program":"ea4e52b4b8fd781649fda3fe1d0d06566425cffdafa0ac61e20327b3df31a060","schema":1,"target":{"backend":"ink_baseline_wasm","bridge":"U32 snapshot/input copy/result return; runner 5dda74bc9a61e108bbd30dbabfc55c82d4807eb84a9771298e273beba641968e","driver":"node: v26.1.0; peak_bytes=exported Wasm linear-memory highwater only; host/GPU excluded","hardware":"Apple M2","toolchain":"{\"ink\": \"45670dbced0999e945278d7de7ed495cad9b43b1ab9d24c27182c9f9a5683e08\", \"rustc\": \"rustc 1.96.0 (ac68faa20 2026-05-25)\\nbinary: rustc\\ncommit-hash: ac68faa20c58cbccd01ee7208bf3b6e93a7d7f96\\ncommit-date: 2026-05-25\\nhost: aarch64-apple-darwin\\nrelease: 1.96.0\\nLLVM version: 22.1.2\", \"zig\": \"0.15.2\"}"},"workload":{"concurrency":1,"distribution":"full-32","residency":"host-resident typed U32 input; warm modules","shape":{"case":"calibrated_squares","factor":4294967293,"length":32,"seed":2147483648}}}
