{"entries":["997bf220c372563b89f5bed29b7169a2ee751050371510ef725168d31e66cca5"],"metrics":{"complete_call_ns":["8610","6597","6677","6812","6632","6809","6795","6722","6723"],"peak_bytes":1310720},"plan":"4be852d107928b26d053b92547919eb6c1ae8de2c5690fc105dd5d537ffe1b58","program":"ed33ab27c983879db95c87066708f1fa4899d58f6a79cb947d82b28541ddabaa","schema":1,"target":{"backend":"ink_prior_wasm","bridge":"Per-task U32 snapshots/typed capture, independent lists; runner 6702d75d37b39ab1a8a7c398a43a73c7b741c8600c43ef72758327c7ea6bbf43","driver":"node:v26.1.0; exported Wasm memory only","hardware":"Apple M2","toolchain":"{\"ink\": \"45670dbced0999e945278d7de7ed495cad9b43b1ab9d24c27182c9f9a5683e08\", \"rustc\": \"rustc 1.96.0 (ac68faa20 2026-05-25)\\nbinary: rustc\\ncommit-hash: ac68faa20c58cbccd01ee7208bf3b6e93a7d7f96\\ncommit-date: 2026-05-25\\nhost: aarch64-apple-darwin\\nrelease: 1.96.0\\nLLVM version: 22.1.2\", \"zig\": \"0.15.2\"}"},"workload":{"concurrency":1,"distribution":"abi_accepted_checksum/small-4096","residency":"resident host input; warm modules; captured calls","shape":{"case":"abi_accepted_checksum","factor":7,"length":4096,"second_length":0,"seed":512}}}
