{"entries":[],"metrics":{"complete_call_ns":["5652","6059","5954","4952","5965","5673","4997","4946","4910"],"peak_bytes":1638400},"plan":"31f2f5568b1c0520f26e23bb8ecfccd5d95a982f904ab676d5241a2929bc3cb2","program":"b6c5fce4f49a4c7e0f1d93b27d9e0f8c05eb69e3aaf206c4cc3580b4d05ded76","schema":1,"target":{"backend":"ink_baseline_wasm","bridge":"Per-task U32 snapshots/typed capture, independent lists; runner 44de375aa121e18792a3cd6c6d322866071e8311b8f02ba74b98406f132e349b","driver":"node:v26.1.0; exported Wasm memory only","hardware":"Apple M2","toolchain":"{\"ink\": \"45670dbced0999e945278d7de7ed495cad9b43b1ab9d24c27182c9f9a5683e08\", \"rustc\": \"rustc 1.96.0 (ac68faa20 2026-05-25)\\nbinary: rustc\\ncommit-hash: ac68faa20c58cbccd01ee7208bf3b6e93a7d7f96\\ncommit-date: 2026-05-25\\nhost: aarch64-apple-darwin\\nrelease: 1.96.0\\nLLVM version: 22.1.2\", \"zig\": \"0.15.2\"}"},"workload":{"concurrency":1,"distribution":"gated_predicate_count_u32/enabled-full-4096","residency":"resident host input; warm modules; captured calls","shape":{"case":"gated_predicate_count_u32","factor":2654435770,"length":4096,"second_length":0,"seed":2654435769}}}
