{"entries":[],"metrics":{"complete_call_ns":["12600000","12600000","12550000","12650000","12750000","12550000","12500000"],"peak_bytes":1179648},"plan":"3967adaf05cad414fbc1bf30989472f3675411723e0db95d707690da2bb6c6c7","program":"a3f2e299efc71891a54f9331278a86aade48c6e40957dfe164370bb3895f0d6c","schema":1,"target":{"backend":"rust_literal_wasm","bridge":"U32 snapshot/input copy/result return; runner 7dd4b7194f21ba7602b9862e2d50b9528a13c34593a2af7eab9255db16191916","driver":"browser: Mozilla/5.0 (Macintosh; Intel Mac OS X 10_15_7) AppleWebKit/537.36 (KHTML, like Gecko) Chrome/154.0.0.0 Safari/537.36; peak_bytes=exported Wasm linear-memory highwater only; host/GPU excluded","hardware":"Apple M2","toolchain":"{\"ink\": \"f5a95c77d31376964fc619d5a6e37933d6ec2593621a3cc2865a518710c3bdff\", \"rustc\": \"rustc 1.96.0 (ac68faa20 2026-05-25)\\nbinary: rustc\\ncommit-hash: ac68faa20c58cbccd01ee7208bf3b6e93a7d7f96\\ncommit-date: 2026-05-25\\nhost: aarch64-apple-darwin\\nrelease: 1.96.0\\nLLVM version: 22.1.2\", \"zig\": \"0.15.2\"}"},"workload":{"concurrency":1,"distribution":"small-4096","residency":"host-resident typed U32 input; warm modules","shape":{"case":"cubic","factor":7,"length":4096,"seed":512}}}
