{"entries":["ef0ff5a36c797e7217f0ab6d6ccf0034481d46b6c3c8a17fec04bd3d622cc2ed"],"metrics":{"complete_call_ns":["2360812","2093094","1990719","1925271","1924693","1997333","2002734","1916547","1951557"],"peak_bytes":1769472},"plan":"87e686a5a94384aefa2a34a7de8cded8f589fa3bdea6b4eaa1f618267d30340a","program":"0f04816fcf4f035d1e5cf0b0d523973c0c51f2dcfdfbd0f0c21774169a135f41","schema":1,"target":{"backend":"ink_new_checked_wasm","bridge":"Declared natural list inputs captured and full-result transport; runner d4b857098b32d4cd79a0375ffa24a76993b1a2d08fb86d14c3b63f6560e435f1","driver":"node:v26.1.0; exported Wasm memory only","hardware":"Apple M2","toolchain":"{\"ink\": \"37ce5c483041904d081e53d644d20f797dc76cd4554371e84af6064432ee5ee2\", \"rustc\": \"rustc 1.96.0 (ac68faa20 2026-05-25)\\nbinary: rustc\\ncommit-hash: ac68faa20c58cbccd01ee7208bf3b6e93a7d7f96\\ncommit-date: 2026-05-25\\nhost: aarch64-apple-darwin\\nrelease: 1.96.0\\nLLVM version: 22.1.2\", \"wasm_sha256\": \"f6e193d6db585f75ddc6a4294b7affcbed3ac0e5a1956e8973f2aeeef57560d1\", \"zig\": \"0.15.2\"}"},"workload":{"concurrency":1,"distribution":"aligned_left_pair_u32/small-65536","residency":"resident host inputs; warm modules; captured complete calls","shape":{"case":"aligned_left_pair_u32","factor":256,"length":65536,"second_length":49152,"seed":512}}}
