{"entries":[],"metrics":{"complete_call_ns":["838","806","838","865","822","838","811","811","822"],"peak_bytes":2097152},"plan":"c918ce0b066e59c6a1093d53b696c723e95c3a1f2f2a1fbc2e553dbdfcbd0306","program":"f5ecf9d0446456e8c73d1b1e0e7599761fc9fa7823f920efdfd5c6d671953604","schema":1,"target":{"backend":"rust_expert_wasm","bridge":"One-list target-native input capture and full-result transport; runner 373bddc12ac554fa3ec370ed46de6ca361fbe3d5e5c525d6ae80aee9cedfd560","driver":"browser:Mozilla/5.0 (Macintosh; Intel Mac OS X 10_15_7) AppleWebKit/537.36 (KHTML, like Gecko) Chrome/154.0.0.0 Safari/537.36; exported Wasm memory only","hardware":"Apple M2","toolchain":"{\"ink\": null, \"rustc\": \"rustc 1.96.0 (ac68faa20 2026-05-25)\\nbinary: rustc\\ncommit-hash: ac68faa20c58cbccd01ee7208bf3b6e93a7d7f96\\ncommit-date: 2026-05-25\\nhost: aarch64-apple-darwin\\nrelease: 1.96.0\\nLLVM version: 22.1.2\", \"wasm_sha256\": \"c918ce0b066e59c6a1093d53b696c723e95c3a1f2f2a1fbc2e553dbdfcbd0306\", \"zig\": \"0.15.2\"}"},"workload":{"concurrency":1,"distribution":"accepted_repair_u32/small-32","residency":"resident host inputs; warm modules; captured complete calls","shape":{"case":"accepted_repair_u32","factor":256,"length":32,"second_length":0,"seed":512}}}
